{
  "trash_id": "5128baeb2b081b72126bc8482b2a86a0",
  "name": "[SQP] SQP-1 (2160p)",
  "trash_score_set": "sqp-1-2160p",
  "trash_description": "This Special Quality Profile is an advanced Quality Profile designed for a specific use case. Before using this Quality Profile please join the <a href=\"https://trash-guides.info/discord\" target=\"_blank\">TRaSH-Guide Discord</a> for more information. Open the #access-to-sqp channel and accept the three simple rules. Any questions related to the SQP should only be asked in the dedicated SQP support channels.",
  "group": 98,
  "upgradeAllowed": true,
  "cutoff": "Bluray-2160p",
  "minFormatScore": 1000,
  "cutoffFormatScore": 10000,
  "minUpgradeFormatScore": 1,
  "language": "Original",
  "items": [
    { "name": "Bluray-2160p", "allowed": true },
    {
      "name": "WEB 2160p",
      "allowed": true,
      "items": ["WEBRip-2160p", "WEBDL-2160p"]
    },
    {
      "name": "Bluray|WEB-1080p",
      "allowed": true,
      "items": ["Bluray-1080p", "WEBDL-1080p", "WEBRip-1080p", "WEBDL-720p", "WEBRip-720p"]
    },
    { "name": "Bluray-720p", "allowed": true },
    { "name": "Raw-HD", "allowed": false },
    { "name": "BR-DISK", "allowed": false },
    { "name": "Remux-2160p", "allowed": false },
    { "name": "HDTV-2160p", "allowed": false },
    { "name": "Remux-1080p", "allowed": false },
    { "name": "HDTV-1080p", "allowed": false },
    { "name": "HDTV-720p", "allowed": false },
    { "name": "Bluray-576p", "allowed": false },
    { "name": "Bluray-480p", "allowed": false },
    {
      "name": "WEB 480p",
      "allowed": false,
      "items": ["WEBRip-480p", "WEBDL-480p"]
    },
    { "name": "DVD-R", "allowed": false },
    { "name": "DVD", "allowed": false },
    { "name": "SDTV", "allowed": false },
    { "name": "DVDSCR", "allowed": false },
    { "name": "REGIONAL", "allowed": false },
    { "name": "TELECINE", "allowed": false },
    { "name": "TELESYNC", "allowed": false },
    { "name": "CAM", "allowed": false },
    { "name": "WORKPRINT", "allowed": false },
    { "name": "Unknown", "allowed": false }
  ],
  "formatItems": {
    "TrueHD ATMOS": "496f355514737f7d83bf7aa4d24f8169",
    "DTS X": "2f22d89048b01681dde8afe203bf2e95",
    "ATMOS (undefined)": "417804f7f2c4308c1f4c5d380d4c4475",
    "DD+ ATMOS": "1af239278386be2919e1bcee0bde047e",
    "TrueHD": "3cafb66171b47f226146a0770576870f",
    "DTS-HD MA": "dcf3ec6938fa32445f590a4da84256cd",
    "FLAC": "a570d4a0e56a2874b64e5bfa55202a1b",
    "PCM": "e7c2fcae07cbada050a0af3357491d7b",
    "DTS-HD HRA": "8e109e50e0a0b83a5098b056e13bf6db",
    "DD+": "185f1dd7264c4562b9022d963ac37424",
    "DTS-ES": "f9f847ac70a0af62ea4a08280b859636",
    "DTS": "1c1a4c5e823891c75bc50380a6866f73",
    "AAC": "240770601cc226190c367ef59aba7463",
    "DD": "c2998bd0d90ed5621d8df281e839436e",
    "DV (w/o HDR fallback)": "923b6abef9b17f937fab56cfcf89e1f1",
    "BHDStudio": "5153ec7413d9dae44e24275589b5e944",
    "hallowed": "7a0d1ad358fee9f5b074af3ef3f9d9ef",
    "WEB Tier 01": "c20f169ef63c5f40c2def54abaf4438e",
    "WEB Tier 02": "403816d65392c79236dcb6dd591aeda4",
    "WEB Tier 03": "af94e0fe497124d1f9ce732069ec8c3b",
    "HD Bluray Tier 01": "ed27ebfef2f323e964fb1f61391bcb35",
    "HD Bluray Tier 02": "c20c8647f2746a1f4c4262b0fbbeeeae",
    "HD Bluray Tier 03": "5608c71bcebba0a5e666223bae8c9227",
    "UHD Bluray Tier 01": "4d74ac4c4db0b64bff6ce0cffef99bf0",
    "UHD Bluray Tier 02": "a58f517a70193f8e578056642178419d",
    "UHD Bluray Tier 03": "e71939fae578037e7aed3ee219bbe7c1",
    "Repack/Proper": "e7718d7a3ce595f289bfee26adc178f5",
    "Repack2": "ae43b294509409a6a13919dedd4764c4",
    "Repack3": "5caaaa1c08c1742aa4342d8c4cc463f2",
    "BR-DISK": "ed38b889b31be83fda192888e2286d83",
    "LQ": "90a6f9a284dff5103f6346090e6280c8",
    "LQ (Release Title)": "e204b80c87be9497a8a6eaff48f72905",
    "x265 (no HDR/DV)": "839bea857ed2c0a8e084f3cbdbd65ecb",
    "3D": "b8cd450cbfa689c0259a01d9e29ba3d6",
    "Extras": "0a3f082873eb454bde444150b70253cc",
    "Sing-Along Versions": "712d74cd88bceb883ee32f773656b1f5",
    "10bit": "a5d148168c4506b55cf53984107c396e",
    "AV1": "cae4ca30163749b891686f95532519bd",
    "1080p": "820b09bb9acbfde9c35c71e0e565dad8",
    "720p": "b2be17d608fc88818940cd1833b0b24c"
  }
}
