{
  "trash_id": "76a5053bdb2d1e4a8f16a69a37d46c12",
  "name": "Remux + WEB 2160p",
  "trash_description": "Quality Profile that covers:<br>- WEBDL: 2160p<br>- Remux: 2160p",
  "trash_url": "https://trash-guides.info/Radarr/radarr-setup-quality-profiles/#remux-web-2160p",
  "group": 1,
  "upgradeAllowed": true,
  "cutoff": "Remux-2160p",
  "minFormatScore": 0,
  "cutoffFormatScore": 10000,
  "minUpgradeFormatScore": 1,
  "language": "Original",
  "items": [
    { "name": "Remux-2160p", "allowed": true },
    {
      "name": "WEB 2160p",
      "allowed": true,
      "items": ["WEBRip-2160p", "WEBDL-2160p"]
    },
    { "name": "Raw-HD", "allowed": false },
    { "name": "BR-DISK", "allowed": false },
    { "name": "Bluray-2160p", "allowed": false },
    { "name": "HDTV-2160p", "allowed": false },
    { "name": "Remux-1080p", "allowed": false },
    { "name": "Bluray-1080p", "allowed": false },
    {
      "name": "WEB 1080p",
      "allowed": false,
      "items": ["WEBRip-1080p", "WEBDL-1080p"]
    },
    { "name": "HDTV-1080p", "allowed": false },
    { "name": "Bluray-720p", "allowed": false },
    {
      "name": "WEB 720p",
      "allowed": false,
      "items": ["WEBRip-720p", "WEBDL-720p"]
    },
    { "name": "HDTV-720p", "allowed": false },
    { "name": "Bluray-576p", "allowed": false },
    { "name": "Bluray-480p", "allowed": false },
    {
      "name": "WEB 480p",
      "allowed": false,
      "items": ["WEBRip-480p", "WEBDL-480p"]
    },
    { "name": "DVD-R", "allowed": false },
    { "name": "DVD", "allowed": false },
    { "name": "SDTV", "allowed": false },
    { "name": "DVDSCR", "allowed": false },
    { "name": "REGIONAL", "allowed": false },
    { "name": "TELECINE", "allowed": false },
    { "name": "TELESYNC", "allowed": false },
    { "name": "CAM", "allowed": false },
    { "name": "WORKPRINT", "allowed": false },
    { "name": "Unknown", "allowed": false }
  ],
  "formatItems": {
    "Remux Tier 01": "3a3ff47579026e76d6504ebea39390de",
    "Remux Tier 02": "9f98181fe5a3fbeb0cc29340da2a468a",
    "Remux Tier 03": "8baaf0b3142bf4d94c42a724f034e27a",
    "WEB Tier 01": "c20f169ef63c5f40c2def54abaf4438e",
    "WEB Tier 02": "403816d65392c79236dcb6dd591aeda4",
    "WEB Tier 03": "af94e0fe497124d1f9ce732069ec8c3b",
    "Repack/Proper": "e7718d7a3ce595f289bfee26adc178f5",
    "Repack2": "ae43b294509409a6a13919dedd4764c4",
    "Repack3": "5caaaa1c08c1742aa4342d8c4cc463f2"
  }
}
