{
  "trash_id": "bf3cc2e99ad9a804a9b0d0e538e1fbba",
  "name": "[German] Anime HD Bluray + WEB",
  "trash_description": "German Anime Quality Profile that covers:<br>- WEBDL: 720p, 1080p<br>- Bluray: 720p, 1080p",
  "group": 11,
  "trash_score_set": "german-anime",
  "upgradeAllowed": true,
  "cutoff": "Merged QPs",
  "minFormatScore": 0,
  "cutoffFormatScore": 35000,
  "minUpgradeFormatScore": 1,
  "language": "Any",
  "items": [
    { "name": "Unknown", "allowed": false },
    { "name": "WORKPRINT", "allowed": false },
    { "name": "CAM", "allowed": false },
    { "name": "TELESYNC", "allowed": false },
    { "name": "TELECINE", "allowed": false },
    { "name": "REGIONAL", "allowed": false },
    { "name": "DVDSCR", "allowed": false },
    { "name": "SDTV", "allowed": false },
    { "name": "DVD", "allowed": false },
    { "name": "DVD-R", "allowed": false },
    {
      "name": "WEB 480p",
      "allowed": false,
      "items": ["WEBDL-480p", "WEBRip-480p"]
    },
    { "name": "Bluray-480p", "allowed": false },
    { "name": "Bluray-576p", "allowed": false },
    { "name": "HDTV-720p", "allowed": false },
    { "name": "HDTV-1080p", "allowed": false },
    { "name": "Remux-1080p", "allowed": false },
    { "name": "HDTV-2160p", "allowed": false },
    {
      "name": "WEB 2160p",
      "allowed": false,
      "items": ["WEBDL-2160p", "WEBRip-2160p"]
    },
    { "name": "Bluray-2160p", "allowed": false },
    { "name": "Remux-2160p", "allowed": false },
    { "name": "BR-DISK", "allowed": false },
    { "name": "Raw-HD", "allowed": false },
    {
      "name": "Merged QPs",
      "allowed": true,
      "items": [
        "WEBRip-720p",
        "WEBDL-720p",
        "Bluray-720p",
        "WEBDL-1080p",
        "WEBRip-1080p",
        "Bluray-1080p"
      ]
    }
  ],
  "formatItems": {
    "German 1080p Booster": "3bc8df3a71baaac60a31ef696ea72d36",
    "1080p": "820b09bb9acbfde9c35c71e0e565dad8",
    "720p": "b2be17d608fc88818940cd1833b0b24c",
    "German": "86bc3115eb4e9873ac96904a4a68e19e",
    "German DL": "f845be10da4f442654c13e1f2c3d6cd5",
    "German DL (undefined)": "6aad77771dabe9d3e9d7be86f310b867",
    "Not German, Japanese or English": "532c4a41c94ae0f77c745ae478883c44",
    "German Anime Subbed": "ee425f921dd740621523343bffe82fa3",
    "German Anime Bluray Tier 01": "b2ff1353b447d4ca6acc3a83a52cda59",
    "German Anime Bluray Tier 02": "82cc7396f79afb2da7ac485235254ade",
    "German Anime Bluray Tier 03": "aa9661d31c293c4951967f2e4a4f232b",
    "German Anime Web Tier 01": "c9215ef384f238e89a2f07f9cfd71978",
    "German Anime Web Tier 02": "d0af6c5754b3bd6abb99e7bfe8fdf5b9",
    "German Anime Web Tier 03": "97572e721cc2dc21ee696d716dede779",
    "German Anime Scene": "90cfd463ac844e4911ee277ddd566d87",
    "German Anime LQ": "022b23b2bd48b78344fef74a89952e94",
    "German LQ": "263943bc5d99550c68aad0c4278ba1c7",
    "German LQ (release title)": "a826ee9e46607bc61795c85a6f2b1279",
    "German Microsized": "03c430f326f10a27a9739b8bc83c30e4",
    "Line/Mic Dubbed": "c465ccc73923871b3eb1802042331306",
    "HD Bluray Tier 01": "ed27ebfef2f323e964fb1f61391bcb35",
    "HD Bluray Tier 02": "c20c8647f2746a1f4c4262b0fbbeeeae",
    "HD Bluray Tier 03": "5608c71bcebba0a5e666223bae8c9227",
    "WEB Tier 01": "c20f169ef63c5f40c2def54abaf4438e",
    "WEB Tier 02": "403816d65392c79236dcb6dd591aeda4",
    "WEB Tier 03": "af94e0fe497124d1f9ce732069ec8c3b",
    "Repack/Proper": "e7718d7a3ce595f289bfee26adc178f5",
    "Repack2": "ae43b294509409a6a13919dedd4764c4",
    "Repack3": "5caaaa1c08c1742aa4342d8c4cc463f2",
    "BR-DISK": "ed38b889b31be83fda192888e2286d83",
    "Generated Dynamic HDR": "e6886871085226c3da1830830146846c",
    "LQ": "90a6f9a284dff5103f6346090e6280c8",
    "LQ (Release Title)": "e204b80c87be9497a8a6eaff48f72905",
    "3D": "b8cd450cbfa689c0259a01d9e29ba3d6",
    "Extras": "0a3f082873eb454bde444150b70253cc",
    "AV1": "cae4ca30163749b891686f95532519bd",
    "Anime BD Tier 01 (Top SeaDex Muxers)": "fb3ccc5d5cc8f77c9055d4cb4561dded",
    "Anime BD Tier 02 (SeaDex Muxers)": "66926c8fa9312bc74ab71bf69aae4f4a",
    "Anime BD Tier 03 (SeaDex Muxers)": "fa857662bad28d5ff21a6e611869a0ff",
    "Anime BD Tier 04 (SeaDex Muxers)": "f262f1299d99b1a2263375e8fa2ddbb3",
    "Anime BD Tier 05 (Remuxes)": "ca864ed93c7b431150cc6748dc34875d",
    "Anime BD Tier 06 (FanSubs)": "9dce189b960fddf47891b7484ee886ca",
    "Anime BD Tier 07 (P2P/Scene)": "1ef101b3a82646b40e0cab7fc92cd896",
    "Anime BD Tier 08 (Mini Encodes)": "6115ccd6640b978234cc47f2c1f2cadc",
    "Anime Web Tier 01 (Muxers)": "8167cffba4febfb9a6988ef24f274e7e",
    "Anime Web Tier 02 (Top FanSubs)": "8526c54e36b4962d340fce52ef030e76",
    "Anime Web Tier 03 (Official Subs)": "de41e72708d2c856fa261094c85e965d",
    "Anime Web Tier 04 (Official Subs)": "9edaeee9ea3bcd585da9b7c0ac3fc54f",
    "Anime Web Tier 05 (FanSubs)": "22d953bbe897857b517928f3652b8dd3",
    "Anime Web Tier 06 (FanSubs)": "a786fbc0eae05afe3bb51aee3c83a9d4",
    "Anime Raws": "06b6542a47037d1e33b15aa3677c2365",
    "Anime LQ Groups": "b0fdc5897f68c9a68c70c25169f77447",
    "Uncensored": "064af5f084a0a24458cc8ecd3220f93f",
    "v0": "c259005cbaeb5ab44c06eddb4751e70c",
    "v1": "5f400539421b8fcf71d51e6384434573",
    "v2": "3df5e6dfef4b09bb6002f732bed5b774",
    "v3": "db92c27ba606996b146b57fbe6d09186",
    "v4": "d4e5e842fad129a3c097bdb2d20d31a0",
    "VRV": "60f6d50cbd3cfc3e9a8c00e3a30c3114",
    "10bit": "a5d148168c4506b55cf53984107c396e",
    "Anime Dual Audio": "4a3b087eea2ce012fcc1ce319259a3be",
    "Dubs Only": "b23eae459cc960816f2d6ba84af45055",
    "VOSTFR": "9172b2f683f6223e3a1846427b417a3d",
    "FastSUB": "7f9b93f82b7e996391525f2be1d891e0"
  }
}
