{
  "trash_id": "1fef28c8c919f31cd86283b1baf527d4",
  "name": "[French MULTi.VO] UHD Remux (2160p)",
  "trash_description": "French Quality Profile that covers:<br>- WEBDL: 1080p, 2160p<br>- Bluray: 2160p<br>- Remux: 2160p",
  "trash_url": "https://trash-guides.info/Radarr/radarr-setup-quality-profiles-french-en/#uhd-remux-2160p",
  "group": 21,
  "trash_score_set": "french-multi-vo",
  "upgradeAllowed": true,
  "cutoff": "Remux-2160p",
  "minFormatScore": 0,
  "cutoffFormatScore": 10000,
  "minUpgradeFormatScore": 1,
  "language": "Original",
  "items": [
    { "name": "Remux-2160p", "allowed": true },
    {
      "name": "Bluray|WEB 2160p",
      "allowed": true,
      "items": ["Bluray-2160p", "WEBRip-2160p", "WEBDL-2160p"]
    },
    { "name": "Raw-HD", "allowed": false },
    { "name": "BR-DISK", "allowed": false },
    { "name": "HDTV-2160p", "allowed": false },
    { "name": "Remux-1080p", "allowed": false },
    { "name": "Bluray-1080p", "allowed": false },
    {
      "name": "WEB 1080p",
      "allowed": false,
      "items": ["WEBRip-1080p", "WEBDL-1080p"]
    },
    { "name": "HDTV-1080p", "allowed": false },
    { "name": "Bluray-720p", "allowed": false },
    {
      "name": "WEB 720p",
      "allowed": false,
      "items": ["WEBRip-720p", "WEBDL-720p"]
    },
    { "name": "HDTV-720p", "allowed": false },
    { "name": "Bluray-576p", "allowed": false },
    { "name": "Bluray-480p", "allowed": false },
    {
      "name": "WEB 480p",
      "allowed": false,
      "items": ["WEBRip-480p", "WEBDL-480p"]
    },
    { "name": "DVD-R", "allowed": false },
    { "name": "DVD", "allowed": false },
    { "name": "SDTV", "allowed": false },
    { "name": "DVDSCR", "allowed": false },
    { "name": "REGIONAL", "allowed": false },
    { "name": "TELECINE", "allowed": false },
    { "name": "TELESYNC", "allowed": false },
    { "name": "CAM", "allowed": false },
    { "name": "WORKPRINT", "allowed": false },
    { "name": "Unknown", "allowed": false }
  ],
  "formatItems": {
    "VFF": "404c08fd0bd67f39b4d8e5709319094e",
    "VOF": "4cafa20d5584f6ba1871d1b8941aa3cb",
    "VFI": "52772f1cad6b5d26c2551f79bc538a50",
    "VF2": "29b5f7b1a5f20f64228786c3ab1bdc7d",
    "VFQ": "b6ace47331a1d3b77942fc18156f6df6",
    "VOQ": "f7caa1942be5cc547c266bd3dbc2cda9",
    "VQ": "95aa50f71a01c82354a7a2b385f1c4d8",
    "VFB": "b3fb499641d7b3c2006be1d9eb014cb3",
    "Language: Not Original": "d6e9318c875905d6cfb5bee961afcea9",
    "Language: Not French": "533f782474f0819643c2ec0c1eeeb0ac",
    "Language: Original + French": "0542a48746585dc4444bbbb8a6bdf6ea",
    "MULTi": "4b900e171accbfb172729b63323ea8ca",
    "FR Remux Tier 01": "5583260016e0b9f683f53af41fb42e4a",
    "FR Remux Tier 02": "9019d81307e68cd4a7eb06a567e833b8",
    "FR UHD Bluray Tier 01": "64f8f12bbf7472a6ccf838bfd6b5e3e8",
    "FR UHD Bluray Tier 02": "0dcf0c8a386d82e3f2d424189af14065",
    "FR WEB Tier 01": "9790a618cec1aeac8ce75601a17ea40d",
    "FR WEB Tier 02": "3c83a765f84239716bd5fd2d7af188f9",
    "FR Scene Groups": "0d94489c0d5828cd3bf9409d309fb32b",
    "Remux Tier 01": "3a3ff47579026e76d6504ebea39390de",
    "Remux Tier 02": "9f98181fe5a3fbeb0cc29340da2a468a",
    "Remux Tier 03": "8baaf0b3142bf4d94c42a724f034e27a",
    "UHD Bluray Tier 01": "4d74ac4c4db0b64bff6ce0cffef99bf0",
    "UHD Bluray Tier 02": "a58f517a70193f8e578056642178419d",
    "UHD Bluray Tier 03": "e71939fae578037e7aed3ee219bbe7c1",
    "WEB Tier 01": "c20f169ef63c5f40c2def54abaf4438e",
    "WEB Tier 02": "403816d65392c79236dcb6dd591aeda4",
    "WEB Tier 03": "af94e0fe497124d1f9ce732069ec8c3b",
    "Repack/Proper": "e7718d7a3ce595f289bfee26adc178f5",
    "Repack2": "ae43b294509409a6a13919dedd4764c4",
    "Repack3": "5caaaa1c08c1742aa4342d8c4cc463f2",
    "Upscaled": "bfd8eb01832d646a0a89c4deb46f8564",
    "Sing-Along Versions": "712d74cd88bceb883ee32f773656b1f5"
  }
}
