{
  "trash_id": "a7bb1539fd147256b21b1098f3dc2016",
  "name": "[SQP] SQP-5",
  "trash_score_set": "sqp-5",
  "trash_description": "This Special Quality Profile is an advanced Quality Profile designed for a specific use case. Before using this Quality Profile please join the <a href=\"https://trash-guides.info/discord\" target=\"_blank\">TRaSH-Guide Discord</a> for more information. Open the #access-to-sqp channel and accept the three simple rules. Any questions related to the SQP should only be asked in the dedicated SQP support channels.",
  "group": 98,
  "upgradeAllowed": true,
  "cutoff": "WEBDL|Bluray|2160p",
  "minFormatScore": 550,
  "cutoffFormatScore": 10000,
  "minUpgradeFormatScore": 1,
  "language": "Original",
  "items": [
    {
      "name": "WEBDL|Bluray|2160p",
      "allowed": true,
      "items": ["WEBDL-2160p", "WEBRip-2160p", "Bluray-2160p", "WEBRip-1080p", "WEBDL-1080p"]
    },
    { "name": "Remux-1080p", "allowed": true },
    { "name": "Raw-HD", "allowed": false },
    { "name": "BR-DISK", "allowed": false },
    { "name": "Remux-2160p", "allowed": false },
    { "name": "HDTV-2160p", "allowed": false },
    { "name": "Bluray-1080p", "allowed": false },
    { "name": "HDTV-1080p", "allowed": false },
    { "name": "Bluray-720p", "allowed": false },
    {
      "name": "WEB 720p",
      "allowed": false,
      "items": ["WEBRip-720p", "WEBDL-720p"]
    },
    { "name": "HDTV-720p", "allowed": false },
    { "name": "Bluray-576p", "allowed": false },
    { "name": "Bluray-480p", "allowed": false },
    {
      "name": "WEB 480p",
      "allowed": false,
      "items": ["WEBRip-480p", "WEBDL-480p"]
    },
    { "name": "DVD-R", "allowed": false },
    { "name": "DVD", "allowed": false },
    { "name": "SDTV", "allowed": false },
    { "name": "DVDSCR", "allowed": false },
    { "name": "REGIONAL", "allowed": false },
    { "name": "TELECINE", "allowed": false },
    { "name": "TELESYNC", "allowed": false },
    { "name": "CAM", "allowed": false },
    { "name": "WORKPRINT", "allowed": false },
    { "name": "Unknown", "allowed": false }
  ],
  "formatItems": {
    "Remux Tier 01": "3a3ff47579026e76d6504ebea39390de",
    "Remux Tier 02": "9f98181fe5a3fbeb0cc29340da2a468a",
    "Remux Tier 03": "8baaf0b3142bf4d94c42a724f034e27a",
    "UHD Bluray Tier 01": "4d74ac4c4db0b64bff6ce0cffef99bf0",
    "UHD Bluray Tier 02": "a58f517a70193f8e578056642178419d",
    "UHD Bluray Tier 03": "e71939fae578037e7aed3ee219bbe7c1",
    "WEB Tier 01": "c20f169ef63c5f40c2def54abaf4438e",
    "WEB Tier 02": "403816d65392c79236dcb6dd591aeda4",
    "WEB Tier 03": "af94e0fe497124d1f9ce732069ec8c3b",
    "Repack/Proper": "e7718d7a3ce595f289bfee26adc178f5",
    "Repack2": "ae43b294509409a6a13919dedd4764c4",
    "Repack3": "5caaaa1c08c1742aa4342d8c4cc463f2",
    "BR-DISK": "ed38b889b31be83fda192888e2286d83",
    "LQ": "90a6f9a284dff5103f6346090e6280c8",
    "LQ (Release Title)": "e204b80c87be9497a8a6eaff48f72905",
    "3D": "b8cd450cbfa689c0259a01d9e29ba3d6",
    "Extras": "0a3f082873eb454bde444150b70253cc",
    "Sing-Along Versions": "712d74cd88bceb883ee32f773656b1f5",
    "AV1": "cae4ca30163749b891686f95532519bd",
    "1080p": "820b09bb9acbfde9c35c71e0e565dad8",
    "2160p": "fb392fb0d61a010ae38e49ceaa24a1ef"
  }
}
