{
  "trash_id": "d1d310673359205736b4b84acd5ea8c8",
  "name": "Remux 2160p (Combined)",
  "trash_description": "Quality Profile that covers:<br>- WEBDL: 1080p, 2160p<br>- Bluray: 1080p, 2160p<br>- Remux: 1080p, 2160p",
  "trash_url": "https://trash-guides.info/Radarr/radarr-setup-quality-profiles/#remux-web-2160p",
  "group": 2,
  "upgradeAllowed": true,
  "cutoff": "Remux-2160p",
  "minFormatScore": 0,
  "cutoffFormatScore": 10000,
  "minUpgradeFormatScore": 1,
  "language": "Original",
  "items": [
    { "name": "Remux-2160p", "allowed": true },
    { "name": "Bluray-2160p", "allowed": true },
    {
      "name": "WEB 2160p",
      "allowed": true,
      "items": ["WEBRip-2160p", "WEBDL-2160p"]
    },
    { "name": "Remux-1080p", "allowed": true },
    { "name": "Bluray-1080p", "allowed": true },
    {
      "name": "WEB 1080p",
      "allowed": true,
      "items": ["WEBRip-1080p", "WEBDL-1080p"]
    },
    { "name": "HDTV-1080p", "allowed": false },
    { "name": "Bluray-720p", "allowed": false },
    {
      "name": "WEB 720p",
      "allowed": false,
      "items": ["WEBRip-720p", "WEBDL-720p"]
    },
    { "name": "HDTV-720p", "allowed": false },
    { "name": "Bluray-576p", "allowed": false },
    { "name": "Bluray-480p", "allowed": false },
    {
      "name": "WEB 480p",
      "allowed": false,
      "items": ["WEBRip-480p", "WEBDL-480p"]
    },
    { "name": "HDTV-2160p", "allowed": false },
    { "name": "Raw-HD", "allowed": false },
    { "name": "BR-DISK", "allowed": false },
    { "name": "DVD-R", "allowed": false },
    { "name": "DVD", "allowed": false },
    { "name": "SDTV", "allowed": false },
    { "name": "DVDSCR", "allowed": false },
    { "name": "REGIONAL", "allowed": false },
    { "name": "TELECINE", "allowed": false },
    { "name": "TELESYNC", "allowed": false },
    { "name": "CAM", "allowed": false },
    { "name": "WORKPRINT", "allowed": false },
    { "name": "Unknown", "allowed": false }
  ],
  "formatItems": {
    "Remux Tier 01": "3a3ff47579026e76d6504ebea39390de",
    "Remux Tier 02": "9f98181fe5a3fbeb0cc29340da2a468a",
    "Remux Tier 03": "8baaf0b3142bf4d94c42a724f034e27a",
    "UHD Bluray Tier 01": "4d74ac4c4db0b64bff6ce0cffef99bf0",
    "UHD Bluray Tier 02": "a58f517a70193f8e578056642178419d",
    "UHD Bluray Tier 03": "e71939fae578037e7aed3ee219bbe7c1",
    "HD Bluray Tier 01": "ed27ebfef2f323e964fb1f61391bcb35",
    "HD Bluray Tier 02": "c20c8647f2746a1f4c4262b0fbbeeeae",
    "HD Bluray Tier 03": "5608c71bcebba0a5e666223bae8c9227",
    "WEB Tier 01": "c20f169ef63c5f40c2def54abaf4438e",
    "WEB Tier 02": "403816d65392c79236dcb6dd591aeda4",
    "WEB Tier 03": "af94e0fe497124d1f9ce732069ec8c3b",
    "Repack/Proper": "e7718d7a3ce595f289bfee26adc178f5",
    "Repack2": "ae43b294509409a6a13919dedd4764c4",
    "Repack3": "5caaaa1c08c1742aa4342d8c4cc463f2"
  }
}
