{
  "trash_id": "79faa9943cef2f510b997b1f2a9f3ea6",
  "name": "[German] Remux + WEB 2160p",
  "trash_description": "German Quality Profile that covers:<br>- WEBDL: 2160p<br>- Remux: 2160p",
  "trash_url": "https://trash-guides.info/Radarr/radarr-setup-quality-profiles-german-en/#uhd-remux-web",
  "group": 11,
  "trash_score_set": "german",
  "upgradeAllowed": true,
  "cutoff": "Merged QPs",
  "minFormatScore": 0,
  "cutoffFormatScore": 35000,
  "minUpgradeFormatScore": 1,
  "language": "Any",
  "items": [
    {
      "name": "Merged QPs",
      "allowed": true,
      "items": ["Remux-2160p", "WEBDL-2160p", "WEBRip-2160p"]
    },
    { "name": "Raw-HD", "allowed": false },
    { "name": "BR-DISK", "allowed": false },
    { "name": "Bluray-2160p", "allowed": false },
    { "name": "HDTV-2160p", "allowed": false },
    { "name": "Remux-1080p", "allowed": false },
    { "name": "Bluray-1080p", "allowed": false },
    {
      "name": "WEB 1080p",
      "allowed": false,
      "items": ["WEBRip-1080p", "WEBDL-1080p"]
    },
    { "name": "HDTV-1080p", "allowed": false },
    { "name": "Bluray-720p", "allowed": false },
    {
      "name": "WEB 720p",
      "allowed": false,
      "items": ["WEBRip-720p", "WEBDL-720p"]
    },
    { "name": "HDTV-720p", "allowed": false },
    { "name": "Bluray-576p", "allowed": false },
    { "name": "Bluray-480p", "allowed": false },
    {
      "name": "WEB 480p",
      "allowed": false,
      "items": ["WEBRip-480p", "WEBDL-480p"]
    },
    { "name": "DVD-R", "allowed": false },
    { "name": "DVD", "allowed": false },
    { "name": "SDTV", "allowed": false },
    { "name": "DVDSCR", "allowed": false },
    { "name": "REGIONAL", "allowed": false },
    { "name": "TELECINE", "allowed": false },
    { "name": "TELESYNC", "allowed": false },
    { "name": "CAM", "allowed": false },
    { "name": "WORKPRINT", "allowed": false },
    { "name": "Unknown", "allowed": false }
  ],
  "formatItems": {
    "German 1080p Booster": "3bc8df3a71baaac60a31ef696ea72d36",
    "German 2160p Booster": "cc7b1e64e2513a6a271090cdfafaeb55",
    "2160p": "fb392fb0d61a010ae38e49ceaa24a1ef",
    "1080p": "820b09bb9acbfde9c35c71e0e565dad8",
    "720p": "b2be17d608fc88818940cd1833b0b24c",
    "German": "86bc3115eb4e9873ac96904a4a68e19e",
    "German DL": "f845be10da4f442654c13e1f2c3d6cd5",
    "German DL (undefined)": "6aad77771dabe9d3e9d7be86f310b867",
    "Not German or English": "4eadb75fb23d09dfc0a8e3f687e72287",
    "German Remux Tier 01": "8608a2ed20c636b8a62de108e9147713",
    "German Remux Tier 02": "f9cf598d55ce532d63596b060a6db9ee",
    "German Web Tier 01": "a2ab25194f463f057a5559c03c84a3df",
    "German Web Tier 02": "08d120d5a003ec4954b5b255c0691d79",
    "German Web Tier 03": "439f9d71becaed589058ec949e037ff3",
    "German Scene": "2d136d4e33082fe573d06b1f237c40dd",
    "Remux Tier 01": "3a3ff47579026e76d6504ebea39390de",
    "Remux Tier 02": "9f98181fe5a3fbeb0cc29340da2a468a",
    "Remux Tier 03": "8baaf0b3142bf4d94c42a724f034e27a",
    "WEB Tier 01": "c20f169ef63c5f40c2def54abaf4438e",
    "WEB Tier 02": "403816d65392c79236dcb6dd591aeda4",
    "WEB Tier 03": "af94e0fe497124d1f9ce732069ec8c3b",
    "Repack/Proper": "e7718d7a3ce595f289bfee26adc178f5",
    "Repack2": "ae43b294509409a6a13919dedd4764c4",
    "Repack3": "5caaaa1c08c1742aa4342d8c4cc463f2"
  }
}
