{
  "trash_id": "05fbf054ac8ad0303335026cc2632f1a",
  "name": "WEBDL 2160p (Combined)",
  "trash_description": "Quality Profile that covers:<br>- WEBDL: 1080p, 2160p",
  "group": 2,
  "upgradeAllowed": true,
  "cutoff": "WEB 2160p",
  "minFormatScore": 0,
  "cutoffFormatScore": 10000,
  "minUpgradeFormatScore": 1,
  "language": "Original",
  "items": [
    {
      "name": "WEB 2160p",
      "allowed": true,
      "items": ["WEBRip-2160p", "WEBDL-2160p"]
    },
    {
      "name": "WEB 1080p",
      "allowed": true,
      "items": ["WEBRip-1080p", "WEBDL-1080p"]
    },
    {
      "name": "WEB 720p",
      "allowed": false,
      "items": ["WEBRip-720p", "WEBDL-720p"]
    },
    {
      "name": "WEB 480p",
      "allowed": false,
      "items": ["WEBRip-480p", "WEBDL-480p"]
    },
    { "name": "Remux-2160p", "allowed": false },
    { "name": "Bluray-2160p", "allowed": false },
    { "name": "Remux-1080p", "allowed": false },
    { "name": "Bluray-1080p", "allowed": false },
    { "name": "HDTV-1080p", "allowed": false },
    { "name": "Bluray-720p", "allowed": false },
    { "name": "HDTV-720p", "allowed": false },
    { "name": "Bluray-576p", "allowed": false },
    { "name": "Bluray-480p", "allowed": false },
    { "name": "HDTV-2160p", "allowed": false },
    { "name": "Raw-HD", "allowed": false },
    { "name": "BR-DISK", "allowed": false },
    { "name": "DVD-R", "allowed": false },
    { "name": "DVD", "allowed": false },
    { "name": "SDTV", "allowed": false },
    { "name": "DVDSCR", "allowed": false },
    { "name": "REGIONAL", "allowed": false },
    { "name": "TELECINE", "allowed": false },
    { "name": "TELESYNC", "allowed": false },
    { "name": "CAM", "allowed": false },
    { "name": "WORKPRINT", "allowed": false },
    { "name": "Unknown", "allowed": false }
  ],
  "formatItems": {
    "WEB Tier 01": "c20f169ef63c5f40c2def54abaf4438e",
    "WEB Tier 02": "403816d65392c79236dcb6dd591aeda4",
    "WEB Tier 03": "af94e0fe497124d1f9ce732069ec8c3b",
    "Repack3": "5caaaa1c08c1742aa4342d8c4cc463f2",
    "Repack2": "ae43b294509409a6a13919dedd4764c4",
    "Repack/Proper": "e7718d7a3ce595f289bfee26adc178f5"
  }
}
